{
  "$schema": "https://json-schema.org/draft/2020-12/schema",
  "title": "Biomedical Agent Teams Source Corpus v2",
  "type": "object",
  "additionalProperties": false,
  "required": [
    "schema_version",
    "corpus_id",
    "plugin_version",
    "workflow_run_id",
    "created_at",
    "query_or_origin",
    "sources"
  ],
  "properties": {
    "schema_version": { "const": "2.0" },
    "corpus_id": { "$ref": "#/$defs/nonEmptyString" },
    "plugin_version": { "$ref": "#/$defs/semanticVersion" },
    "workflow_run_id": { "$ref": "#/$defs/nonEmptyString" },
    "created_at": { "type": "string", "format": "date-time" },
    "query_or_origin": { "$ref": "#/$defs/nonEmptyString" },
    "sources": {
      "type": "array",
      "uniqueItems": true,
      "items": { "$ref": "#/$defs/source" }
    }
  },
  "$defs": {
    "nonEmptyString": {
      "type": "string",
      "minLength": 1,
      "pattern": ".*\\S.*"
    },
    "sha256": {
      "type": "string",
      "pattern": "^[A-Fa-f0-9]{64}$"
    },
    "semanticVersion": {
      "type": "string",
      "pattern": "^[0-9]+\\.[0-9]+\\.[0-9]+(?:[-+][0-9A-Za-z.-]+)?$"
    },
    "bundlePath": {
      "type": "string",
      "minLength": 1,
      "pattern": "^(?![A-Za-z]:)(?![/\\\\])(?!.*(?:^|[/\\\\])\\.\\.(?:[/\\\\]|$)).+"
    },
    "sourceType": {
      "type": "string",
      "enum": [
        "PMID",
        "DOI",
        "accession",
        "NCT",
        "database-record",
        "local-file",
        "analysis-artifact",
        "software",
        "other"
      ]
    },
    "evidenceSpan": {
      "type": "object",
      "additionalProperties": false,
      "required": [
        "span_id",
        "source_id",
        "source_snapshot_ref",
        "source_snapshot_sha256",
        "locator",
        "section",
        "paragraph_or_table",
        "sentence_or_cell",
        "evidence_text_sha256",
        "short_evidence_excerpt",
        "retrieved_at",
        "extraction_actor",
        "limitations"
      ],
      "properties": {
      "extraction": {
        "type": "object",
        "additionalProperties": false,
        "required": [
          "kind"
        ],
        "properties": {
          "locator_map_ref": {
            "$ref": "#/$defs/bundlePath"
          },
          "locator_map_sha256": {
            "$ref": "#/$defs/sha256"
          },
          "kind": {
            "enum": [
              "quotation",
              "summary",
              "human-verified",
              "not-checked"
            ]
          },
          "text_ref": {
            "$ref": "#/$defs/bundlePath"
          },
          "text_sha256": {
            "$ref": "#/$defs/sha256"
          },
          "original_snapshot_sha256": {
            "$ref": "#/$defs/sha256"
          },
          "normalization": {
            "const": "NFC-LF"
          },
          "offset_unit": {
            "const": "unicode-codepoint"
          },
          "start": {
            "type": "integer",
            "minimum": 0
          },
          "end": {
            "type": "integer",
            "minimum": 1
          },
          "extractor": {
            "type": "string",
            "minLength": 1
          },
          "extractor_version": {
            "type": "string",
            "minLength": 1
          },
          "supporting_span_ids": {
            "type": "array",
            "uniqueItems": true,
            "items": {
              "type": "string",
              "minLength": 1
            }
          },
          "review_instance_id": {
            "type": "string",
            "minLength": 1
          },
          "rationale": {
            "type": "string",
            "minLength": 1
          }
        }
      },
        "span_id": { "$ref": "#/$defs/nonEmptyString" },
        "source_id": { "$ref": "#/$defs/nonEmptyString" },
        "source_snapshot_ref": { "$ref": "#/$defs/bundlePath" },
        "source_snapshot_sha256": { "$ref": "#/$defs/sha256" },
        "locator": { "$ref": "#/$defs/nonEmptyString" },
        "section": { "$ref": "#/$defs/nonEmptyString" },
        "paragraph_or_table": { "$ref": "#/$defs/nonEmptyString" },
        "sentence_or_cell": { "$ref": "#/$defs/nonEmptyString" },
        "evidence_text_sha256": { "$ref": "#/$defs/sha256" },
        "short_evidence_excerpt": {
          "type": "string",
          "minLength": 1,
          "maxLength": 1000,
          "pattern": ".*\\S.*"
        },
        "retrieved_at": { "type": "string", "format": "date-time" },
        "extraction_actor": { "$ref": "#/$defs/nonEmptyString" },
        "limitations": { "$ref": "#/$defs/nonEmptyString" }
      }
    },
    "source": {
      "type": "object",
      "additionalProperties": false,
      "required": [
        "source_id",
        "source_type",
        "identifier",
        "version_or_retrieval_date",
        "inclusion_status",
        "claim_use",
        "checked_by",
        "limitations"
      ],
      "properties": {
        "source_id": { "$ref": "#/$defs/nonEmptyString" },
        "source_type": { "$ref": "#/$defs/sourceType" },
        "identifier": { "$ref": "#/$defs/nonEmptyString" },
        "title_or_name": { "$ref": "#/$defs/nonEmptyString" },
        "version_or_retrieval_date": { "$ref": "#/$defs/nonEmptyString" },
        "retrieved_at": { "type": "string", "format": "date-time" },
        "database_version": { "$ref": "#/$defs/nonEmptyString" },
        "query_or_origin": { "$ref": "#/$defs/nonEmptyString" },
        "inclusion_status": {
          "type": "string",
          "enum": ["included", "excluded", "not-checked", "blocked"]
        },
        "claim_use": { "$ref": "#/$defs/nonEmptyString" },
        "checked_by": { "$ref": "#/$defs/nonEmptyString" },
        "limitations": { "$ref": "#/$defs/nonEmptyString" },
        "evidence_spans": {
          "type": "array",
          "uniqueItems": true,
          "items": { "$ref": "#/$defs/evidenceSpan" }
        }
      },
      "allOf": [
        {
          "if": {
            "properties": { "inclusion_status": { "const": "included" } },
            "required": ["inclusion_status"]
          },
          "then": {
            "required": ["evidence_spans"],
            "properties": { "evidence_spans": { "minItems": 1 } }
          }
        }
      ]
    }
  }
}
